title;description;assigned_to_id;created_by_id;due_date;status;priority
Pellentesque Habitant Limited;augue malesuada malesuada. Integer id magna et ipsum cursus;1;2;2026-02-28T00:00:00Z;IN_PROGRESS;CRITICAL
Ligula Consectetuer Corporation;aliquet nec, imperdiet nec, leo. Morbi;1;2;Oct 24, 2025;IN_PROGRESS;CRITICAL
Nunc Sollicitudin Foundation;quis massa. Mauris vestibulum, neque sed dictum eleifend, nunc risus;1;2;Nov 20, 2024;IN_PROGRESS;URGENT
Praesent Eu LLC;dignissim pharetra. Nam;1;2;Oct 3, 2025;COMPLETED;HIGH
Orci Donec Nibh Industries;ligula. Aenean;1;2;Dec 10, 2024;COMPLETED;CRITICAL
Tincidunt Vehicula Risus Corporation;Vivamus non lorem vitae odio sagittis;1;2;Jan 29, 2026;IN_PROGRESS;LOW
In Corp.;volutpat ornare, facilisis eget,;1;2;Dec 28, 2025;PENDING;LOW
Diam Sed Institute;vulputate ullamcorper magna.;1;2;Apr 10, 2026;PENDING;HIGH
Orci Donec Ltd;Quisque fringilla euismod enim. Etiam;1;2;Nov 17, 2025;COMPLETED;HIGH
Felis Company;ut cursus luctus, ipsum leo elementum;1;2;Feb 28, 2026;PENDING;HIGH
Sit Incorporated;orci sem eget massa. Suspendisse;1;2;Jul 14, 2024;IN_PROGRESS;HIGH
Blandit Foundation;vitae;1;2;Aug 16, 2025;COMPLETED;LOW
Risus Institute;nunc, ullamcorper eu, euismod ac, fermentum vel, mauris. Integer;1;2;Feb 28, 2026;COMPLETED;MEDIUM
Mauris Limited;eu nulla at sem molestie;1;2;Feb 22, 2026;IN_PROGRESS;MEDIUM
Leo Vivamus Associates;vulputate ullamcorper magna. Sed eu eros. Nam consequat dolor;1;2;Jun 5, 2024;PENDING;HIGH
Egestas LLC;ante lectus convallis;1;2;Nov 20, 2025;PENDING;MEDIUM
Orci Phasellus Dapibus PC;bibendum fermentum metus. Aenean sed pede;1;2;Dec 26, 2024;COMPLETED;LOW
Vulputate Industries;Nullam vitae diam.;1;2;Jun 28, 2025;IN_PROGRESS;HIGH
Inceptos Hymenaeos Company;congue, elit sed;1;2;Aug 31, 2025;COMPLETED;CRITICAL
Phasellus Corp.;urna justo faucibus lectus, a sollicitudin orci sem;1;2;May 19, 2024;COMPLETED;LOW
Molestie Dapibus Foundation;dolor vitae dolor. Donec fringilla. Donec feugiat;1;2;Jan 5, 2025;COMPLETED;HIGH
Venenatis A Limited;leo. Cras vehicula aliquet libero. Integer in;1;2;Jul 16, 2024;PENDING;MEDIUM
In Molestie Tortor LLC;ligula eu enim. Etiam imperdiet dictum magna. Ut tincidunt orci;1;2;Mar 3, 2025;IN_PROGRESS;LOW
Urna Limited;et ultrices posuere;1;2;Sep 17, 2024;PENDING;CRITICAL
Pede Cras Corp.;eget nisi dictum augue malesuada malesuada. Integer id;1;2;Apr 11, 2025;COMPLETED;URGENT
Nibh Donec Est Institute;ultricies adipiscing, enim mi tempor lorem, eget;1;2;Feb 28, 2025;COMPLETED;CRITICAL
Donec Est Inc.;Phasellus dolor elit, pellentesque a, facilisis non, bibendum sed,;1;2;Feb 22, 2025;IN_PROGRESS;CRITICAL
Nulla Facilisi Corp.;a, facilisis non, bibendum sed, est.;1;2;Jul 28, 2025;IN_PROGRESS;CRITICAL
Ut LLP;ac turpis egestas. Aliquam fringilla;1;2;May 31, 2025;PENDING;CRITICAL
Sed Neque Consulting;velit eget;1;2;Jan 28, 2026;PENDING;CRITICAL
Pede Foundation;nibh vulputate mauris sagittis;1;2;Oct 7, 2024;IN_PROGRESS;MEDIUM
Quisque Industries;facilisis, magna tellus faucibus leo,;1;2;Jan 16, 2025;IN_PROGRESS;LOW
Sit Amet Luctus Industries;magna. Suspendisse tristique neque venenatis lacus.;1;2;Oct 14, 2024;PENDING;CRITICAL
Velit Justo Institute;egestas lacinia. Sed congue, elit;1;2;Sep 16, 2024;IN_PROGRESS;URGENT
Sed Hendrerit Consulting;molestie orci tincidunt adipiscing. Mauris molestie;1;2;Aug 4, 2025;IN_PROGRESS;URGENT
Ornare Sagittis Inc.;egestas ligula. Nullam;1;2;May 20, 2025;COMPLETED;URGENT
Gravida Aliquam Corporation;porttitor scelerisque neque. Nullam nisl. Maecenas malesuada fringilla est.;1;2;Jan 7, 2026;IN_PROGRESS;LOW
Odio A PC;senectus et netus et malesuada fames ac turpis;1;2;Apr 11, 2026;IN_PROGRESS;HIGH
Phasellus Dapibus Institute;tristique aliquet. Phasellus fermentum convallis ligula. Donec;1;2;May 19, 2024;COMPLETED;HIGH
Cursus Vestibulum Mauris Corporation;tellus lorem;1;2;Sep 7, 2025;COMPLETED;CRITICAL
Est Company;consectetuer adipiscing elit.;1;2;Nov 2, 2024;COMPLETED;MEDIUM
Tellus Inc.;tempor augue ac ipsum. Phasellus;1;2;Sep 21, 2024;IN_PROGRESS;HIGH
Velit Company;Curabitur massa. Vestibulum accumsan neque et nunc.;1;2;Jun 15, 2025;PENDING;HIGH
Tempor Corp.;eros. Proin ultrices. Duis volutpat nunc sit amet;1;2;Oct 2, 2024;COMPLETED;HIGH
Suspendisse Foundation;torquent per conubia nostra,;1;2;Apr 28, 2026;IN_PROGRESS;CRITICAL
Mi Enim LLC;nisl. Nulla;1;2;Aug 25, 2025;PENDING;LOW
Dapibus Ltd;mauris ut mi. Duis risus;1;2;Dec 28, 2024;PENDING;HIGH
Integer Corp.;at, velit. Pellentesque ultricies dignissim lacus.;1;2;Mar 8, 2026;COMPLETED;LOW
Egestas Associates;diam at pretium;1;2;Feb 5, 2025;IN_PROGRESS;MEDIUM
Semper LLP;est. Mauris eu turpis. Nulla aliquet. Proin;1;2;Oct 13, 2024;COMPLETED;URGENT
Sagittis Placerat Inc.;aliquam arcu. Aliquam ultrices iaculis odio. Nam interdum enim;1;2;Dec 5, 2024;PENDING;URGENT
Fringilla LLC;lacinia orci, consectetuer;1;2;Jul 23, 2025;PENDING;URGENT
Ligula Nullam Industries;et, euismod et, commodo at, libero.;1;2;Jan 19, 2025;IN_PROGRESS;LOW
Suspendisse Ac Institute;est ac facilisis facilisis, magna tellus;1;2;Nov 29, 2025;COMPLETED;MEDIUM
Arcu Iaculis LLP;elit, pretium et, rutrum non, hendrerit id, ante. Nunc;1;2;Sep 26, 2025;IN_PROGRESS;CRITICAL
Cursus LLP;Vestibulum accumsan neque et nunc. Quisque ornare tortor at;1;2;Sep 7, 2025;COMPLETED;URGENT
Adipiscing Lobortis Associates;sollicitudin commodo ipsum. Suspendisse non leo. Vivamus;1;2;Mar 29, 2025;COMPLETED;MEDIUM
Cras Lorem Company;diam. Proin dolor. Nulla;1;2;Mar 18, 2026;PENDING;CRITICAL
Vitae Erat Limited;risus odio, auctor vitae, aliquet nec, imperdiet nec, leo.;1;2;Aug 28, 2025;PENDING;URGENT
Rhoncus Id Mollis Limited;arcu. Sed eu nibh vulputate;1;2;Jul 12, 2024;PENDING;MEDIUM
Integer Tincidunt Industries;non lorem;1;2;Oct 11, 2025;PENDING;LOW
Nullam Feugiat PC;arcu. Sed;1;2;Jun 3, 2024;IN_PROGRESS;LOW
In At Pede LLP;Mauris nulla.;1;2;Jun 24, 2024;IN_PROGRESS;MEDIUM
In Faucibus Orci LLC;vel arcu eu odio tristique pharetra.;1;2;Apr 30, 2025;PENDING;HIGH
Proin Dolor Nulla LLP;nonummy ipsum non arcu. Vivamus sit amet risus. Donec;1;2;Mar 10, 2026;PENDING;HIGH
Dapibus Ligula Aliquam Associates;felis. Nulla tempor augue ac;1;2;Jan 13, 2026;PENDING;LOW
Malesuada Incorporated;non, bibendum sed,;1;2;Nov 2, 2025;IN_PROGRESS;MEDIUM
Non Lacinia Limited;In scelerisque scelerisque dui. Suspendisse ac metus vitae velit egestas;1;2;Jan 31, 2026;IN_PROGRESS;LOW
Amet Consectetuer PC;varius. Nam porttitor scelerisque neque. Nullam nisl. Maecenas;1;2;Jun 29, 2024;IN_PROGRESS;HIGH
Nulla Foundation;ullamcorper, nisl arcu iaculis enim, sit;1;2;May 23, 2024;COMPLETED;HIGH
Inceptos LLP;ut, sem. Nulla interdum. Curabitur dictum. Phasellus in;1;2;Nov 16, 2025;PENDING;HIGH
Ipsum Suspendisse Limited;in consequat;1;2;Aug 3, 2024;PENDING;LOW
Lectus Ante Industries;porta elit, a feugiat tellus lorem;1;2;Jul 29, 2024;PENDING;HIGH
Porttitor Corporation;pede. Nunc sed orci lobortis;1;2;Dec 27, 2024;PENDING;CRITICAL
Est Arcu Incorporated;sem egestas blandit. Nam nulla magna, malesuada;1;2;May 23, 2025;PENDING;LOW
Mauris Blandit Limited;mi eleifend egestas. Sed pharetra, felis eget;1;2;Jun 3, 2024;IN_PROGRESS;LOW
Ac Mi Eleifend Ltd;convallis est, vitae sodales;1;2;Feb 18, 2025;PENDING;URGENT
Luctus Ut LLP;cursus, diam at pretium aliquet,;1;2;Aug 21, 2024;COMPLETED;LOW
Sapien Corp.;viverra. Maecenas iaculis;1;2;Mar 5, 2026;COMPLETED;LOW
Nulla Integer Foundation;facilisis lorem tristique aliquet. Phasellus fermentum convallis ligula.;1;2;Mar 11, 2025;IN_PROGRESS;HIGH
Nunc Sed Industries;eu enim. Etiam imperdiet;1;2;Jul 26, 2025;PENDING;URGENT
Auctor Velit Limited;erat volutpat.;1;2;May 13, 2025;IN_PROGRESS;MEDIUM
Dolor Sit Amet PC;ullamcorper;1;2;Nov 2, 2024;PENDING;LOW
At Velit Cras LLP;nulla at sem molestie sodales. Mauris;1;2;Feb 20, 2025;COMPLETED;URGENT
Neque Inc.;auctor odio a purus. Duis elementum, dui quis;1;2;Jul 16, 2025;IN_PROGRESS;URGENT
Sit Amet Ltd;a, scelerisque sed, sapien. Nunc pulvinar;1;2;Oct 18, 2025;PENDING;MEDIUM
Nibh Sit Institute;feugiat nec, diam. Duis mi enim, condimentum;1;2;Apr 21, 2026;COMPLETED;MEDIUM
Ipsum Institute;aliquet libero.;1;2;Mar 4, 2025;COMPLETED;LOW
Elit Elit Fermentum LLC;velit in aliquet lobortis,;1;2;Dec 27, 2025;IN_PROGRESS;URGENT
Gravida Corp.;lacinia vitae, sodales at, velit. Pellentesque ultricies dignissim;1;2;Jun 6, 2024;COMPLETED;URGENT
Eu Odio Phasellus LLC;lorem, eget mollis lectus pede et risus. Quisque libero;1;2;Jun 29, 2024;IN_PROGRESS;MEDIUM
Mi Ac Inc.;fames ac;1;2;May 17, 2025;IN_PROGRESS;HIGH
Eu Eleifend LLP;Sed;1;2;Dec 27, 2024;IN_PROGRESS;CRITICAL
Lectus Justo Company;mattis. Cras eget nisi dictum;1;2;Oct 18, 2024;IN_PROGRESS;HIGH
Fringilla Cursus Purus Company;mattis. Integer eu lacus. Quisque imperdiet,;1;2;Oct 2, 2025;COMPLETED;HIGH
Ut Tincidunt Corporation;amet, consectetuer adipiscing elit. Curabitur sed tortor. Integer;1;2;Jan 3, 2026;PENDING;LOW
Donec Felis Orci LLC;eu, eleifend nec, malesuada;1;2;Oct 5, 2025;IN_PROGRESS;MEDIUM
Proin Eget Limited;adipiscing;1;2;Jun 25, 2024;COMPLETED;HIGH
Tempor Erat PC;Aenean;1;2;Sep 9, 2025;IN_PROGRESS;URGENT
Ante Bibendum Ullamcorper Corp.;ac turpis egestas. Fusce aliquet magna;1;2;Oct 21, 2025;COMPLETED;CRITICAL
